product_id,product_name,brand_name,mean_sentiment_score,min_sentient_score,max_sentiment_score,review_count,price_usd,primary_category,secondary_category,total_feedback_count,total_neg_feedback_count,total_pos_feedback_count,loves_count,limited_edition,new,online_only,out_of_stock
P481164,Essential Energy Hydrating Day Cream Broad Spectrum SPF 20,Shiseido,0.80865108,-0.8444,0.9952,926,50,Skincare,Moisturizers,102,55,47,2433528,0,0,0,0
P481169,The Silk Sunscreen Mineral Broad Spectrum SPF 50 PA++++ with Hyaluronic Acid and Niacinamide,Tatcha,0.420716289,-0.9575,0.9966,485,62,Skincare,Sunscreen,2716,329,2387,17967795,0,0,0,0
P481334,Moon Fruit Retinol Alternative Sleep Mask,Herbivore,0.466791667,-0.6642,0.9472,12,54,Skincare,Masks,101,11,90,60348,0,0,1,0
P481335,Brightening Saffron Serum - Radiant Rani,RANAVAT,0.787491667,-0.6124,0.9916,216,135,Skincare,Treatments,667,205,462,1570104,0,0,0,0
P481336,Resurfacing Saffron AHA Masque - Radiant Rani,RANAVAT,0.747909392,-0.7707,0.9886,181,75,Skincare,Masks,118,23,95,890158,0,0,0,0
P481339,Alpha Beta Daily Essentials - Extra Strength,Dr. Dennis Gross Skincare,0.649465385,-0.7579,0.9853,26,92,Skincare,Treatments,130,35,95,187590,1,0,0,0
P481340,Alpha Beta AHA/BHA Daily Cleansing Gel,Dr. Dennis Gross Skincare,0.577770159,-0.9634,0.9919,439,39,Skincare,Cleansers,2965,567,2398,4534870,0,0,0,0
P481341,Alpha Beta Daily Moisturizer,Dr. Dennis Gross Skincare,0.741774699,-0.7492,0.9799,83,72,Skincare,Moisturizers,227,150,77,349015,0,0,0,0
P481342,Cleansing & Hydrating Bestseller Set Bento Box,DAMDAM,0.49175,0.128,0.8555,2,42,Skincare,Value & Gift Sets,14,2,12,4412,1,0,1,0
P481347,Clear Skin Kit Acne Treatment Kit,Paula's Choice,0.47465625,-0.9398,0.9912,16,75,Skincare,Value & Gift Sets,95,26,69,62144,0,0,0,0
P481348,Clinical 0.3% Retinol + 2% Bakuchiol Treatment,Paula's Choice,0.765998235,-0.7901,0.9867,170,62,Skincare,Treatments,190,30,160,2369630,0,0,0,0
P481350,Complexion Clarity Kit,Paula's Choice,0.707311111,0,0.9774,9,64,Skincare,Value & Gift Sets,94,25,69,141174,0,0,0,0
P481354,Renewing Bakuchi Crème - Eternal Reign,RANAVAT,0.701427941,-0.9577,0.9868,204,95,Skincare,Moisturizers,267,82,185,442272,0,0,0,0
P481363,Smoothing Facial Polish - Imperial Glow,RANAVAT,0.74213125,-0.795,0.9969,176,45,Skincare,Cleansers,70,11,59,553344,0,0,0,0
P481366,Isle Glow Face Moisturizer SPF 45 with Sea Moss and Niacinamide,CAY SKIN,0.74149236,-0.9327,0.9966,445,34,Skincare,Sunscreen,1812,450,1362,6840095,0,1,0,0
P481367,Isle Lip Balm SPF 30 with Sea Moss and Aloe Stem Cells,CAY SKIN,0.669233772,-0.9234,0.9945,228,14,Skincare,Lip Balms & Treatments,893,125,768,5277744,0,0,0,0
P481368,Detoxifying Facial Massage Tool - Kansa Wand,RANAVAT,0.814522727,0.25,0.9839,22,70,Skincare,Wellness,85,10,75,42218,0,0,0,0
P481371,Balancing Crème Cleanser - Luminous Ceremony,RANAVAT,0.690377457,-0.5233,0.9899,173,45,Skincare,Cleansers,68,18,50,363646,0,0,0,0
P481376,Mini Alpha Beta AHA/BHA Daily Cleansing Gel,Dr. Dennis Gross Skincare,0.556521429,-0.0754,0.9752,14,15,Skincare,Cleansers,41,8,33,98798,0,0,0,0
P481390,Omega+ Complex Moisturizer,Paula's Choice,0.668445313,-0.7128,0.9906,64,37,Skincare,Moisturizers,117,25,92,612352,0,0,0,0
P481397,Revitalizing Supreme+ Bright Soft Creme Moisturizer,Estée Lauder,0.3017,0.3017,0.3017,1,98,Skincare,Moisturizers,11,1,10,1140,0,0,1,0
P481401,Hydrating Jasmine Mist - Royal Refresh,RANAVAT,0.809982857,0,0.9684,35,45,Skincare,Moisturizers,130,39,91,130655,0,0,0,0
P481408,The Canopy Humidifier Starter Set,CANOPY,0.73216087,-0.6908,0.9919,69,150,Skincare,High Tech Tools,459,114,345,521571,0,0,1,0
P481668,Clarifying Do-Over Peel,CLINIQUE,0.4999,-0.1027,0.8397,5,35,Skincare,Treatments,23,6,17,5320,0,0,0,0
P481697,Circular Hydration Serum with Hyaluronic Acid,Dermalogica,0.809412903,-0.7789,0.9951,372,64,Skincare,Treatments,180,65,115,3089832,0,0,0,0
P481699,Cicapair Tiger Grass Calming Serum Mask,Dr. Jart+,0.557616,-0.7226,0.9729,25,9,Skincare,Masks,128,23,105,318325,0,0,0,0
P481700,Cicapair Redness Rescue Kit,Dr. Jart+,0.711845946,-0.8007,0.9943,148,39,Skincare,Value & Gift Sets,279,55,224,2652456,1,0,0,0
P481701,Cloud Cushion Plush Moisturizer with Ceramides + Peptides,EADEM,0.800963576,-0.8226,0.9962,151,58,Skincare,Moisturizers,402,63,339,1739218,0,0,0,0
P481703,Black Tea Corset Cream Firming Moisturizer,fresh,0.638438158,-0.8823,0.9963,152,95,Skincare,Moisturizers,2325,394,1931,512392,0,0,0,0
P481704,Umbrian Clay Pore Purifying Face Mask,fresh,0.6507,0.1779,0.9508,5,58,Skincare,Masks,18,7,11,32095,0,0,0,0
P481710,Fade and Glow AHA Mask,Hyper Skin,0.717165079,-0.7003,0.9899,63,48,Skincare,Masks,183,33,150,431991,0,0,1,0
P481712,Party Recharge Cryo Me Crazy Under-eye Masks,INC.redible,0.698461111,-0.4436,0.993,18,20,Skincare,Eye Care,112,22,90,180144,0,0,1,1
P481732,Radiance Vitamin C Glow Serum,REN Clean Skincare,0.869927427,-0.7726,0.9972,412,69,Skincare,Treatments,217,47,170,3116368,0,0,0,0
P481739,Barrier+ Skin Barrier Niacinamide Restoring Gel Cream,Skinfix,0.746698833,-0.9412,0.9959,771,48,Skincare,Moisturizers,1304,306,998,33156084,0,0,0,0
P481742,Advanced Retinol Daily Repair Face Moisturizer Broad Spectrum SPF 30,StriVectin,0.802671429,-0.2136,0.9864,42,99,Skincare,Moisturizers,26,10,16,48804,0,0,1,0
P481743,Peptight Tightening Neck Serum Roller,StriVectin,0.829122727,-0.296,0.9885,44,79,Skincare,High Tech Tools,193,63,130,407924,0,0,1,0
P481748,Bright Start Vitamin C Antioxidant Brightening Moisturizer,TULA Skincare,0.872885153,-0.501,0.9968,229,56,Skincare,Moisturizers,123,39,84,1412014,0,0,0,0
P481817,"Beauty Elixir Prep, Set, Glow Face Mist",Caudalie,0.683613925,-0.967,0.9972,3404,49,Skincare,Moisturizers,7275,1827,5448,135615360,0,0,0,0
P481825,Hydro UV Defense Sunscreen Broad Spectrum SPF 50+,LANEIGE,0.688353947,-0.72,0.9934,152,30,Skincare,Sunscreen,418,92,326,3000176,0,0,0,0
P481828,Nudescreen Daily Mineral Veil SPF 30,NUDESTIX,0.79599281,-0.8402,0.9942,153,36,Skincare,Moisturizers,289,41,248,871641,0,0,0,0
P481830,Self-Tan Luxe Whipped Crème Mousse,St. Tropez,0.864471912,-0.6908,0.9972,502,48,Skincare,Self Tanners,330,93,237,3794618,0,0,0,0
P481831,Tan Tonic Glow Drops,St. Tropez,0.831290693,-0.8749,0.9971,1053,42,Skincare,Self Tanners,510,119,391,11989458,0,0,0,0
P481832,Gradual Tan Watermelon Daily Firming Lotion,St. Tropez,0.791922423,-0.6854,0.9945,388,29,Skincare,Self Tanners,122,45,77,1842612,0,0,0,0
P481833,Concentrated Ginseng Renewing Cream,Sulwhasoo,0.791883673,-0.777,0.9958,343,260,Skincare,Moisturizers,284,101,183,1240288,0,0,0,0
P481834,Concentrated Ginseng Renewing Cream Classic,Sulwhasoo,0.850677027,-0.3311,0.9944,74,260,Skincare,Moisturizers,50,11,39,119510,0,0,0,0
P481837,The Crème Gradual Self-Tanning Face Moisturizer,TAN-LUXE,0.666544444,-0.5859,0.9613,18,49,Skincare,Self Tanners,161,9,152,84222,0,0,0,0
P481970,Hydra Life Fresh Sorbet Crème Moisturizer,Dior,0.674916667,0.2298,0.973,6,85,Skincare,Moisturizers,16,4,12,7248,0,0,0,0
P481971,Hydra Life Intense Sorbet Crème Moisturizer,Dior,0.738266667,0.4003,0.9253,3,85,Skincare,Moisturizers,24,2,22,6603,0,0,0,0
P481972,La Mousse OFF/ON Foaming Face Cleanser,Dior,0.823670945,-0.891,0.998,561,50,Skincare,Cleansers,133,36,97,5273400,0,0,0,0
P481973,The Better B Niacinamide Serum,Dr. Barbara Sturm,0.773183333,0.1739,0.9902,30,145,Skincare,Treatments,183,71,112,76140,0,0,0,0
P481975,Alpha Beta Daily Essentials - Universal,Dr. Dennis Gross Skincare,0.743922222,-0.5951,0.9823,27,92,Skincare,Value & Gift Sets,71,29,42,97794,1,0,0,0
P481989,Watermelon Glow Niacinamide Sunscreen SPF 50,Glow Recipe,0.620065946,-0.943,0.9969,1295,35,Skincare,Sunscreen,3224,559,2665,83466635,0,0,0,0
P481993,Abeille Royale Intense Repair Youth Oil in Balm,GUERLAIN,0.96,0.96,0.96,1,235,Skincare,Masks,17,8,9,655,0,0,1,0
P482005,Fan Club - multi-symptom menopause support,HUM Nutrition,0.780553012,-0.7717,0.9924,83,40,Skincare,Wellness,69,8,61,60424,0,0,1,0
P482006,Dewy Glow Moisturizer with Cherry Blossom & Niacinamide,innisfree,0.759101107,-0.8958,0.9874,271,26,Skincare,Moisturizers,607,176,431,10979836,0,0,0,0
P482007,Dewy Glow Jam Cleanser with Jeju Cherry Blossom,innisfree,0.7527,-0.2732,0.9908,42,13,Skincare,Cleansers,101,15,86,381990,0,0,0,0
P482008,Self-Tanning Oil Mist,Isle of Paradise,0.760815,-0.9747,0.9961,320,32,Skincare,Self Tanners,965,186,779,5512000,0,0,0,0
P482009,Self-Tanning Mitt,Isle of Paradise,0.572866667,0,0.9719,6,10,Skincare,Self Tanners,20,7,13,28740,0,0,0,0
P482021,Ultra Facial Hydrating Concentrated Cleansing Bar,Kiehl's Since 1851,0.630416667,-0.4438,0.97,6,20,Skincare,Cleansers,18,2,16,9348,0,0,0,0
P482024,Mini The Treatment Lotion,La Mer,0.768347406,-0.942,0.9937,424,125,Skincare,Moisturizers,381,96,285,2209888,0,0,0,0
P482025,Absolue Rich Cream Moisturizer,Lancôme,0.89336063,0,0.9959,127,270,Skincare,Moisturizers,68,4,64,184531,0,0,1,0
P482058,Dr. Andrew Weil for Origins Mega-Mushroom Weightless Hydrating Moisturizer,Origins,0.7262,-0.6608,0.9667,10,40,Skincare,Moisturizers,32,10,22,24240,0,0,1,0
P482061,Max Clear Invisible Priming Sunscreen Broad Spectrum SPF 45,Peter Thomas Roth,0.784036957,-0.8695,0.9917,276,38,Skincare,Sunscreen,247,20,227,1507512,0,0,0,0
P482068,Sacred Sleep Overnight Repair with Retinol,Saint Jane Beauty,0.811342105,-0.802,0.9914,57,70,Skincare,Treatments,326,54,272,214206,0,0,0,0
P482074,Dream Oasis Deep Hydration Serum,Summer Fridays,0.761352156,-0.8245,0.997,487,44,Skincare,Treatments,749,159,590,20164235,0,0,0,0
P482256,Classic Face Organic Sunscreen Lotion SPF 30,COOLA,0.868783333,0.6203,0.9748,6,32,Skincare,Sunscreen,20,14,6,4956,0,0,1,1
P482258,Mineral Face Sunscreen Sheer Matte SPF 30,COOLA,0.3319,-0.7446,0.9718,6,36,Skincare,Sunscreen,27,1,26,7422,0,0,1,0
P482259,Dew Good Illuminating Serum SPF 30,COOLA,0.776677778,0.3307,0.9931,9,48,Skincare,Sunscreen,148,6,142,47286,0,0,1,0
P482260,Rice Drops Face Oil Hydrating Serum,DAMDAM,0.846506989,-0.7224,0.9891,186,68,Skincare,Moisturizers,151,112,39,409758,0,0,1,0
P482264,Cookies N Clean Whipped Clay Pore Detox Face Mask with Salicylic Acid + Charcoal,Fenty Skin,0.813208929,-0.9113,0.996,392,35,Skincare,Masks,2279,316,1963,28798280,0,0,0,1
P482269,Get Even Sun Milk SPF 33,Josie Maran,0.800966333,-0.8869,0.9981,300,46,Skincare,Sunscreen,316,61,255,2034300,0,0,0,0
P482298,Dr. Andrew Weil for Origins Mega-Mushroom Relief & Resilience Soothing Treatment Lotion,Origins,0.748208056,-0.8834,0.9943,571,40,Skincare,Moisturizers,246,102,144,3853679,0,0,1,0
P482309,Facial Cooling Wands,SEPHORA COLLECTION,0.5473,-0.5423,0.9794,4,28,Skincare,High Tech Tools,107,21,86,34100,1,0,1,0
P482311,Large Supplement Case,SEPHORA COLLECTION,0.499781818,-0.296,0.9316,11,15,Skincare,Wellness,342,32,310,78375,0,0,1,0
P482312,Facial Razor Set,SEPHORA COLLECTION,0.446941463,-0.714,0.9705,41,12,Skincare,High Tech Tools,327,64,263,1311467,0,0,0,0
P482313,Eyebrow Razor Set,SEPHORA COLLECTION,0.706214286,0.2212,0.9484,7,8,Skincare,High Tech Tools,26,0,26,23933,0,0,0,0
P482314,Mattifying Blotting Papers,SEPHORA COLLECTION,0.325533333,-0.68,0.9298,15,4,Skincare,Cleansers,89,11,78,94710,0,0,0,0
P482318,Gradual Tan Tinted Daily Firming Lotion,St. Tropez,0.41299375,-0.7684,0.9738,16,29,Skincare,Self Tanners,57,9,48,22352,0,0,1,0
P482320,Mini Glowscreen Sunscreen SPF 40 PA+++ with Hyaluronic Acid + Niacinamide,Supergoop!,0.638309003,-0.9358,0.9971,1455,22,Skincare,Sunscreen,9692,1766,7926,94027920,0,0,0,1
P482321,Mini Mineral Sheerscreen Sunscreen SPF 30 PA+++,Supergoop!,0.638741538,-0.9542,0.9987,455,22,Skincare,Sunscreen,1675,312,1363,2080260,0,0,0,0
P482322,Mini Mineral Mattescreen Sunscreen SPF 40 PA+++,Supergoop!,0.479229167,-0.7096,0.9818,24,22,Skincare,Sunscreen,102,19,83,241896,0,0,0,0
P482323,(Re) Setting Refreshing Mist SPF 40,Supergoop!,0.620544764,-0.9532,0.9923,382,34,Skincare,Sunscreen,995,213,782,12258762,0,0,0,0
P482325,Every. Single. Face. Watery Lotion SPF 50,Supergoop!,0.734819944,-0.8706,0.9944,356,34,Skincare,Sunscreen,905,205,700,8414060,0,0,0,0
P482327,Mini Squalane Cleanser,The Ordinary,0.523137037,-0.8508,0.993,108,9,Skincare,Cleansers,217,68,149,2998080,0,0,0,0
P482328,Mini Natural Moisturizing Factors + HA,The Ordinary,0.483219565,-0.8635,0.9702,92,6.5,Skincare,Treatments,231,68,163,3535652,0,0,0,0
P482329,Retinal + Niacinamide Youth Serum,Youth To The People,0.656177603,-0.8031,0.9933,317,69,Skincare,Treatments,1066,386,680,13138065,0,0,0,0
P482510,The Ultimate Soothing Cream,Augustinus Bader,0.81513,-0.6966,0.9947,100,290,Skincare,Moisturizers,193,32,161,193300,0,0,0,0
P482529,Micro Essence Treatment Lotion with Bio-Ferment,Estée Lauder,0.651251852,-0.7935,0.9971,216,130,Skincare,Moisturizers,59,16,43,396144,0,0,1,0
P482535,Strawberry Smooth BHA + AHA Salicylic Acid Serum,Glow Recipe,0.750712463,-0.9368,0.9972,1027,42,Skincare,Treatments,2747,773,1974,121450966,0,0,0,0
P482540,Correct & Protect Broad Spectrum SPF 45| PA++++,Murad,0.823853533,-0.8536,0.9934,467,69,Skincare,Sunscreen,129,14,115,2606327,0,0,0,0
P482551,C.E.O. Afterglow Brightening Vitamin C Moisturizer,Sunday Riley,0.877806754,-0.7081,0.9963,533,65,Skincare,Moisturizers,712,234,478,8835008,0,0,0,0
P482552,The Clarifying Clay Mask Exfoliating Pore Treatment,Tatcha,0.792914833,-0.953,0.9972,209,70,Skincare,Masks,801,187,614,9766988,0,0,0,0
P482661,The Essence,Augustinus Bader,0.4357,-0.1528,0.9717,4,93,Skincare,Treatments,50,4,46,10256,0,0,0,0
P482675,Active Blast Concentrated Collagen Daily Treatment,FaceGym,0.822654455,-0.6629,0.9934,101,65,Skincare,Treatments,56,16,40,171195,0,0,1,0
P482676,10% Waterless Vitamin C Serum,Farmacy,0.818837681,-0.9313,0.9965,828,50,Skincare,Treatments,952,232,720,23067252,0,0,0,0
P482681,Bye Bye Makeup 3-in-1 Makeup Melting Cleansing Balm,IT Cosmetics,0.807045125,-0.9616,0.995,359,42,Skincare,Cleansers,62,17,45,1927112,0,0,1,0
P482692,Water Bank Blue Hyaluronic Serum,LANEIGE,0.814798392,-0.9484,0.996,311,45,Skincare,Treatments,350,98,252,7700049,0,0,0,0
P482693,Water Bank Blue Hyaluronic Cream Moisturizer,LANEIGE,0.693263286,-0.9415,0.9982,700,40,Skincare,Moisturizers,2962,364,2598,34110300,0,0,0,0
P482694,Mini Water Bank Blue Hyaluronic Cream Moisturizer,LANEIGE,0.548816216,-0.9338,0.9842,37,23,Skincare,Moisturizers,246,49,197,481888,0,0,0,0
P482695,Water Bank Blue Hyaluronic Gel Moisturizer,LANEIGE,0.727627749,-0.8811,0.996,191,40,Skincare,Moisturizers,421,77,344,2986476,0,0,0,0
P482696,Water Bank Blue Hyaluronic Eye Cream,LANEIGE,0.783416794,-0.8889,0.9956,131,43,Skincare,Eye Care,270,59,211,2162548,0,0,0,0
P482697,Water Bank Blue Hyaluronic Revitalizing Toner,LANEIGE,0.515041176,-0.9299,0.9662,17,31,Skincare,Cleansers,77,21,56,136221,0,0,0,0
P482698,Water Bank Blue Hyaluronic Exfoliating Toner,LANEIGE,0.769117647,-0.4215,0.9788,17,31,Skincare,Cleansers,69,13,56,137088,0,0,0,0
P482739,Urban Environment Oil-Free Sunscreen Broad-Spectrum SPF 42,Shiseido,0.776283619,-0.9559,0.9977,1343,50,Skincare,Sunscreen,369,80,289,17284410,0,0,0,0
P482740,Mini Urban Environment Oil-Free Sunscreen Broad-Spectrum SPF 42,Shiseido,0.78786087,0.1027,0.9944,46,35,Skincare,Sunscreen,46,11,35,307280,0,0,0,0
P482741,Urban Environment Oil-Free Mineral Sunscreen Broad-Spectrum SPF 42,Shiseido,0.755156082,-0.7668,0.9976,485,38,Skincare,Sunscreen,77,18,59,1862885,0,0,0,0
P482742,Urban Environment Fresh-Moisture Sunscreen Broad-Spectrum SPF 42,Shiseido,0.804704958,-0.9313,0.9982,1190,38,Skincare,Sunscreen,211,40,171,10268510,0,0,0,0
P482746,PLAY 100% Mineral Lotion SPF 30 with Green Algae,Supergoop!,0.813181818,0.3045,0.9948,11,36,Skincare,Sunscreen,94,16,78,32197,0,0,0,0
P482747,PLAY Mineral Mist SPF 30 with Marigold Extract,Supergoop!,0.0719,-0.8357,0.9795,2,34,Skincare,Sunscreen,9,5,4,3942,0,0,1,0
P482753,Protect + Glow Daily Sunscreen Gel Broad Spectrum SPF 30,TULA Skincare,0.785150254,-0.9184,0.9923,197,38,Skincare,Sunscreen,149,22,127,1768469,0,0,0,0
P482754,Mineral Magic Oil-Free Mineral Sunscreen Fluid Broad Spectrum SPF 30,TULA Skincare,0.652698387,-0.66,0.9943,62,38,Skincare,Sunscreen,111,12,99,235724,0,0,0,0
P482755,Claydate Detoxifying & Toning Face Mask Stick,TULA Skincare,0.844947222,-0.3919,0.9946,36,36,Skincare,Masks,6,2,4,52560,0,0,0,0
P482757,Mini The Cult Classic Purifying Face Cleanser,TULA Skincare,0.681181463,-0.8878,0.9929,410,12,Skincare,Cleansers,750,180,570,2830640,0,0,0,0
P483057,COOLA Organic Liplux Classic Sunscreen Lip Oil SPF 30,COOLA,0.217265,-0.8481,0.9845,20,18,Skincare,Lip Balms & Treatments,128,14,114,125860,0,0,0,0
P483058,GOOPGLOW Flower Acids Resurfacing Toner,goop,0.673957143,0.2878,0.9968,7,45,Skincare,Cleansers,32,6,26,12579,0,0,0,0
P483060,Lip Comfort Hydrating Oil,Clarins,0.631871429,-0.9237,0.9904,63,28,Skincare,Lip Balms & Treatments,343,57,286,2226735,0,1,0,0
P483075,Brightening Dual Facial Enzyme Exfoliator,SEPHORA COLLECTION,0.683308,-0.4767,0.9774,25,14,Skincare,Cleansers,144,33,111,194800,0,0,0,0
P483076,C.E.O. Afterglow Brightening Vitamin C Moisturizer,Sunday Riley,0.877806754,-0.7081,0.9963,533,22,Skincare,Moisturizers,712,234,478,1501461,0,1,0,0
P483078,COOLA Scalp & Hair Mist Organic Sunscreen SPF 30,COOLA,0.37285,-0.8689,0.9793,8,28,Skincare,Sunscreen,37,2,35,38016,0,0,0,0
P483086,Essential Comfort Balancing Emulsion,Sulwhasoo,0.4215,0.4215,0.4215,1,72,Skincare,Moisturizers,3,0,3,923,0,0,0,0
P483089,Eye Want It All Face + Eye Microneedling Set,BeautyBio,0.13655,-0.522,0.7951,2,249,Skincare,Value & Gift Sets,20,8,12,2698,0,0,0,0
P483090,Firming Day Moisturizer with Peptides,SEPHORA COLLECTION,0.58224375,-0.6854,0.9816,16,18,Skincare,Moisturizers,72,12,60,46192,0,0,0,0
P483092,Glow Peel Pads with AHA + PHA,SEPHORA COLLECTION,0.508886667,-0.8494,0.9765,30,17,Skincare,Treatments,283,39,244,445350,0,0,0,0
P483127,Retinol Remix 1% Retinol Treatment With Peptide & Tranexamic Acid,iNNBEAUTY PROJECT,0.804658222,-0.8408,0.9959,225,48,Skincare,Treatments,478,95,383,3012075,0,0,0,0
P483128,Scar Gel Treatment,Dr. Zenovia Skincare,0.623622628,-0.9046,0.9839,137,48,Skincare,Treatments,133,27,106,581017,0,0,0,0
P483136,Targeted Anti-Aging Bakuchiol Serum,SEPHORA COLLECTION,0.794269417,-0.5994,0.9955,206,20,Skincare,Treatments,417,113,304,2194518,0,0,0,0
P483137,Targeted Dark Spots Serum with Enzymes,SEPHORA COLLECTION,0.761554088,-0.745,0.9923,318,20,Skincare,Treatments,551,158,393,3877056,0,0,0,0
P483138,Targeted Pores Serum with BHA + PHA,SEPHORA COLLECTION,0.786369412,-0.5834,0.9913,340,20,Skincare,Treatments,229,55,174,4223480,0,0,0,0
P483141,The Quench Eye Reviving Quadralipid Eye Balm,BeautyBio,-0.029733333,-0.8602,0.9322,6,99,Skincare,Eye Care,38,5,33,9642,0,0,0,0
P483145,Ultra Glow Mask with Vitamins C + E,SEPHORA COLLECTION,0.716683333,0,0.982,6,16,Skincare,Masks,29,7,22,26868,0,0,0,0
P483146,Ultra Glow Toner with Vitamins C + E,SEPHORA COLLECTION,0.828957692,-0.5499,0.9904,104,14,Skincare,Moisturizers,221,33,188,1402752,0,0,0,0
P483151,Vitamin Eye Masks,SEPHORA COLLECTION,0.608931429,-0.9034,0.9769,35,3.5,Skincare,Eye Care,228,49,179,911925,0,0,0,0
P483453,Shave Starter Set,Hanni,0.769200552,-0.8821,0.9978,181,68,Skincare,Value & Gift Sets,310,52,258,776852,0,0,0,0
P483455,The Weighted Razor Kit,Hanni,0.755847742,-0.8999,0.9949,155,42,Skincare,High Tech Tools,450,119,331,826615,0,0,0,0
P483457,Shave Pillow Moisturizing Body Gel,Hanni,0.786451316,-0.7643,0.9931,152,24,Skincare,Moisturizers,98,35,63,459496,0,0,0,0
P483458,Blades,Hanni,0.291933333,-0.7956,0.9451,3,6,Skincare,High Tech Tools,16,5,11,4758,0,0,0,0
P483460,Shower Holder,Hanni,0.8953,0.8907,0.8999,2,12,Skincare,High Tech Tools,5,3,2,3864,0,0,0,0
P483494,Go To Bed With Me Anti-Aging Night Routine,Sunday Riley,0.702616667,-0.2023,0.9797,12,93,Skincare,Value & Gift Sets,239,42,197,125532,0,0,0,0
P483495,Wake Up With Me Morning Routine Kit,Sunday Riley,0.7271125,-0.7399,0.9807,16,95,Skincare,Value & Gift Sets,128,27,101,186208,0,0,0,0
P483496,Salicylic Acid 2% Exfoliating Blemish Solution,The Ordinary,0.494,-0.9548,0.9897,77,6.5,Skincare,Treatments,641,160,481,3385767,0,0,0,0
P483643,Willow & Sweet Agave Plumping Lip Mask,alpyn beauty,0.758663514,-0.9091,0.9957,148,28,Skincare,Lip Balms & Treatments,468,74,394,1860064,0,0,1,0
P483658,Mineral Sunscreen Zinc Oxide Broad Spectrum SPF 30,First Aid Beauty,0.750219919,-0.9559,0.9902,246,28,Skincare,Sunscreen,467,120,347,2377344,0,0,0,0
P483661,Moon Fruit 1% Bakuchiol + Peptides Retinol Alternative Serum,Herbivore,0.716797297,-0.9499,0.987,111,62,Skincare,Treatments,505,135,370,1718502,0,0,0,0
P483664,Midnight  Recovery Omega-Rich Cloud Cream,Kiehl's Since 1851,0.804405,-0.6124,0.9972,300,60,Skincare,Moisturizers,274,87,187,3508800,0,0,0,0
P483679,Truth Barrier Booster Orange Ferment Vitamin C Essence,OLEHENRIKSEN,0.867584884,-0.8587,0.998,602,48,Skincare,Moisturizers,618,173,445,14624386,0,0,0,0
P483691,Gradual Tan Classic Daily Youth Boosting Cream,St. Tropez,0.18105,-0.5799,0.942,2,29,Skincare,Self Tanners,16,8,8,3480,0,0,1,0
P483692,Essential Comfort Firming Cream,Sulwhasoo,0.786120623,-0.9512,0.987,257,120,Skincare,Moisturizers,101,29,72,651238,0,0,0,0
P483693,Essential Comfort Moisture Cream,Sulwhasoo,0.289833333,-0.2673,0.9857,3,80,Skincare,Moisturizers,35,3,32,6972,0,0,0,0
P483694,Essential Comfort Balancing Water,Sulwhasoo,0.85575,0.6908,0.9451,4,68,Skincare,Moisturizers,25,1,24,14156,0,0,0,0
P483696,Gentle Micellar Antioxidant Cleanser,The Outset,0.834392857,-0.4753,0.9914,112,32,Skincare,Cleansers,216,60,156,432320,0,0,0,0
P483697,Firming Vegan Collagen Prep Serum,The Outset,0.818951064,-0.8955,0.994,188,46,Skincare,Treatments,258,55,203,1452864,0,0,0,0
P483698,Nourishing Squalane Daily Moisturizer,The Outset,0.749073214,-0.7096,0.9953,112,44,Skincare,Moisturizers,241,101,140,528752,0,0,0,0
P483699,Restorative Niacinamide Night Cream,The Outset,0.804348026,-0.7998,0.9972,152,54,Skincare,Moisturizers,231,94,137,841016,0,0,0,0
P483700,Smoothing Vitamin C Eye + Expression Lines Cream,The Outset,0.777714516,-0.84,0.9931,124,42,Skincare,Eye Care,238,89,149,465248,0,0,0,0
P483701,Daily Essentials Travel Set,The Outset,0.827215741,-0.8456,0.999,108,50,Skincare,Value & Gift Sets,199,57,142,478980,0,0,0,0
P483708,Mini Essential Comfort Firming Cream,Sulwhasoo,0.786120623,-0.9512,0.987,257,28,Skincare,Moisturizers,101,29,72,773056,0,0,0,0
P484033,Mini Squalane + Vitamin C Rose Firming Oil,Biossance,0.57215,-0.7093,0.9811,40,40,Skincare,Moisturizers,132,24,108,903640,0,0,0,0
P484055,Water Bank Blue Hyaluronic Hydration Set,LANEIGE,0.612709615,-0.5844,0.9882,52,45,Skincare,Value & Gift Sets,340,89,251,2093208,0,0,0,0
P484067,Evercalm Barrier Support Face Oil,REN Clean Skincare,0.837241221,-0.5574,0.9959,262,60,Skincare,Moisturizers,266,104,162,2169622,0,0,0,0
P484076,Ultimate Sun Protector SPF 50+ Sunscreen Duo,Shiseido,0.5843,-0.6601,0.9894,10,66,Skincare,Value & Gift Sets,42,5,37,72470,1,1,1,0
P484080,Mini Faded Serum for Dark Spots & Discoloration,Topicals,0.354862786,-0.9814,0.9966,919,18,Skincare,Treatments,15853,4234,11619,85535925,0,0,0,0
P484081,Eye Recharge + Replenish Pro-Ferm Overnight Eye Cream with Bakuchiol and Peptides,TULA Skincare,0.782196063,-0.7417,0.9909,127,56,Skincare,Eye Care,179,29,150,1416685,0,0,0,0
P500002,Brighten. Tighten. Hydrate. 3-Piece Set,JLo Beauty,0.801841045,-0.6753,0.9992,134,64,Skincare,Value & Gift Sets,166,44,122,529568,0,0,0,0
P500012,Rose Hydration Pore-Minimizing Mist,fresh,0.738952941,0,0.9879,17,24,Skincare,Moisturizers,135,32,103,240601,0,0,0,0
P500016,Deep Exfoliating Cleanser,Caudalie,0.726176923,-0.8218,0.9687,13,38,Skincare,Cleansers,91,20,71,119366,0,0,0,0
P500019,The True Cream - Aqua Bomb Sunscreen Broad Spectrum SPF 50,belif,0.750771395,-0.8829,0.9948,423,38,Skincare,Sunscreen,257,47,210,4714758,0,0,0,0
P500039,The Neck Serum - With 5 Peptides | 9% Peptide Blend,Nécessaire,0.808134071,-0.7825,0.994,226,60,Skincare,Moisturizers,451,87,364,4872108,0,0,1,0
P500055,Active Algae Lightweight Moisturizer,KORA Organics,0.833448325,-0.8126,0.9963,209,48,Skincare,Moisturizers,193,41,152,1125256,0,0,0,0
P500060,Play! Mineral SPF Stick,Supergoop!,0.29742,-0.3804,0.9422,5,24,Skincare,Sunscreen,22,3,19,14755,0,0,0,0
P500094,Hydrating Oil-Free Gel Moisturizer,Community Sixty-Six,0.689448548,-0.9047,0.9911,241,25,Skincare,Moisturizers,11,4,7,250399,0,0,1,0
P500096,Oil Control Moisturizer with Niacinamide,Community Sixty-Six,0.42804,-0.7468,0.992,20,25,Skincare,Moisturizers,31,5,26,31000,0,0,1,0
P500098,Makeup Melting Balm Cleanser,Community Sixty-Six,0.584622177,-0.95,0.9924,248,16,Skincare,Cleansers,49,11,38,324384,0,0,1,0
P500101,Hydro Ungrip Makeup Remover + Cleansing Water,MILK MAKEUP,0.855077698,0,0.9907,139,32,Skincare,Cleansers,170,60,110,2033848,0,0,0,0
P500102,Hydro Ungrip Makeup Removing Cleansing Balm,MILK MAKEUP,0.810263415,-0.5927,0.9954,164,36,Skincare,Cleansers,214,90,124,2905916,0,0,0,0
P500106,Everyday Mineral Moisturizer SPF 30 Sunscreen,Community Sixty-Six,0.331,-0.8795,0.9457,13,30,Skincare,Moisturizers,50,10,40,22529,0,0,1,0
P500109,Hydrating Caffeine Eye Cream,Community Sixty-Six,0.588387931,-0.9153,0.9829,116,18,Skincare,Eye Care,91,24,67,382568,0,0,1,0
P500111,Womb Service - OBGYN Formulated Prenatal Support Supplement,HUM Nutrition,0.835191358,-0.3489,0.9904,81,45,Skincare,Wellness,23,10,13,69984,0,0,1,0
P500112,N°41 Facial Sunscreen Mist with SPF 41,HABIT,0.746816746,-0.9398,0.9895,209,30,Skincare,Sunscreen,485,43,442,1980066,0,0,1,0
P500113,Detoxifying AHA/BHA Gel Cleanser,Community Sixty-Six,0.678834454,-0.8703,0.9912,119,16,Skincare,Cleansers,29,11,18,143395,0,0,1,0
P500114,Retinol Resurfacing Night Moisturizer,Community Sixty-Six,0.614790123,-0.822,0.9903,243,35,Skincare,Moisturizers,33,8,25,350406,0,0,1,0
P500116,Hydrating Cream Cleanser with Hyaluronic Acid,Community Sixty-Six,0.784725,0.4019,0.9516,8,16,Skincare,Cleansers,17,2,15,11304,0,0,0,0
