product_id,product_name,brand_name,mean_sentiment_score,min_sentient_score,max_sentiment_score,review_count,price_usd,primary_category,secondary_category,total_feedback_count,total_neg_feedback_count,total_pos_feedback_count,loves_count,limited_edition,new,online_only,out_of_stock
P456572,Vitamin C Dark Circle Correcting Eye Serum,Murad,0.602510309,-0.8221,0.9948,291,67,Skincare,Eye Care,1506,263,1243,6720063,0,0,0,0
P456582,Invisible Physical Defense Mineral Sunscreen SPF30,Dermalogica,0.730733161,-0.8908,0.992,386,48,Skincare,Sunscreen,717,125,592,4132516,0,0,0,0
P456957,Clarifying Serum,SEPHORA COLLECTION,0.591444444,-0.8479,0.9839,63,20,Skincare,Treatments,1342,434,908,667422,0,0,0,1
P456988,Own Your Glow Kit,Isle of Paradise,0.596024286,-0.9715,0.9986,280,35,Skincare,Value & Gift Sets,2487,662,1825,9380560,0,0,0,0
P456989,Super Glow Body Hyaluronic Self-Tan Serum,TAN-LUXE,0.708638298,-0.7772,0.9903,47,49,Skincare,Self Tanners,572,57,515,325099,0,0,0,0
P456990,Mini GENIUS Liquid Collagen,Algenist,0.413291429,-0.8714,0.9704,35,25,Skincare,Mini Size,295,88,207,311500,0,0,0,0
P456991,Superdefense City Block Broad Spectrum SPF 50 Daily Energy + Face Protector Primer,CLINIQUE,0.512007955,-0.9238,0.9897,88,32,Skincare,Sunscreen,1085,180,905,494120,0,0,0,0
P456992,Superdefense SPF 25 Fatigue + 1st Signs of Age Multi-Correcting Cream,CLINIQUE,0.653152941,-0.5361,0.9615,17,56,Skincare,Moisturizers,234,22,212,52632,0,0,0,1
P456994,Eye Duty Niacinamide Brightening Eye Cream,First Aid Beauty,0.583452551,-0.9426,0.9939,392,36,Skincare,Eye Care,2722,596,2126,19332656,0,0,0,0
P456997,Night Serum,Dr. Barbara Sturm,0.624870213,-0.6619,0.988,47,310,Skincare,Treatments,803,196,607,231287,0,0,0,0
P457002,SuperBeauty Daily Antioxidant SkinSupplement,Moon Juice,0.796108696,-0.3612,0.9886,69,60,Skincare,Wellness,798,237,561,469614,0,0,0,1
P457005,Rose & Squalane Deep Hydration Oil-Infused Serum,fresh,0.800464862,-0.7765,0.9984,979,60,Skincare,Treatments,3006,652,2354,54158280,0,0,0,0
P457008,Cryo Rubber Masks,Dr. Jart+,0.75124947,-0.9592,0.9952,566,15,Skincare,Masks,2247,626,1621,53095894,0,0,0,0
P457009,Cryo Rubber Mask with Moisturizing Hyaluronic Acid,Dr. Jart+,0.797766667,0.3595,0.9931,6,15,Skincare,Masks,27,7,20,0,0,0,0,0
P457010,Cryo Rubber Mask with Soothing Allantoin,Dr. Jart+,0.885444444,0.6801,0.9763,9,15,Skincare,Masks,11,2,9,0,0,0,0,0
P457011,Cryo Rubber Mask with Firming Collagen,Dr. Jart+,0.893776923,0.63,0.9882,13,15,Skincare,Masks,58,7,51,0,0,0,0,0
P457012,Cryo Rubber Mask with Brightening Vitamin C,Dr. Jart+,0.767625,-0.716,0.9859,12,15,Skincare,Masks,30,5,25,0,0,0,0,0
P457272,Abeille Royale Anti-Aging Eye Cream,GUERLAIN,0.558064286,-0.5106,0.9708,14,110,Skincare,Eye Care,223,32,191,47880,0,0,1,0
P457273,Immortelle Overnight Reset Eye Serum,L'Occitane,0.39468,-0.8186,0.9641,10,60,Skincare,Eye Care,245,78,167,34150,0,0,1,0
P457274,Hand Cream Trio,L'Occitane,0.738414286,0.3818,0.9622,7,29,Skincare,Value & Gift Sets,47,16,31,57946,1,0,0,0
P457279,Moisturizer Mini knockout brightening gel,tarte,0.7549,0.4019,0.9835,3,14,Skincare,Mini Size,18,2,16,14571,0,0,0,0
P457439,Clarifying Lotion,SEPHORA COLLECTION,0.37522069,-0.6072,0.9658,29,16,Skincare,Treatments,239,81,158,166692,0,0,0,0
P457441,The Clarifying Kit,SEPHORA COLLECTION,0.752342424,-0.9113,0.9902,33,20,Skincare,Value & Gift Sets,273,57,216,312675,0,0,0,0
P457442,Face Serum,SEPHORA COLLECTION,0.426854622,-0.9491,0.9924,238,9,Skincare,Treatments,2509,797,1712,9914366,0,0,0,0
P457468,Brazilliance 2HR Express Deep Foaming Self-Tanner,tarte,0.500183333,-0.831,0.9838,24,39,Skincare,Self Tanners,283,58,225,52968,1,0,0,0
P457510,Private Party: Supports Vaginal & Urinary Tract Health,HUM Nutrition,0.699470504,-0.8943,0.9945,278,26,Skincare,Wellness,1320,366,954,4157490,0,0,1,0
P457512,Overnight Glow Dark Spot Sleeping Cream,REN Clean Skincare,0.662531092,-0.9265,0.9948,476,55,Skincare,Moisturizers,2114,448,1666,9904132,0,0,0,0
P457517,Rose Petal-Soft Deep Hydration Lip Balm,fresh,0.775401717,-0.8922,0.9967,699,25,Skincare,Lip Balms & Treatments,1278,380,898,19717392,0,0,0,0
P457519,Water Drench Hyaluronic Cloud Hydrating Eye Gel,Peter Thomas Roth,0.424454054,-0.9588,0.9792,37,43,Skincare,Eye Care,380,35,345,218929,0,0,0,0
P457520,FIRMx Collagen Moisturizer,Peter Thomas Roth,0.445390323,-0.9579,0.996,31,88,Skincare,Moisturizers,539,93,446,159588,0,0,0,0
P457521,Every Sun Day Mineral Sunscreen SPF 50+,Dr. Jart+,0.725963843,-0.9141,0.9964,484,40,Skincare,Sunscreen,2119,508,1611,14470148,0,0,0,0
P457522,Every Sun Day Sun Fluid SPF 50+,Dr. Jart+,0.743284615,-0.8971,0.9916,325,42,Skincare,Sunscreen,902,191,711,4967625,0,0,0,0
P457694,Blue Algae Vitamin C Dark Spot Correcting Peel,Algenist,0.68397963,-0.8866,0.9952,108,85,Skincare,Treatments,2320,492,1828,1240704,0,0,0,0
P457695,DeliKate Recovery Cream,Kate Somerville,0.723114286,-0.9161,0.9973,350,76,Skincare,Moisturizers,1044,281,763,3136350,0,0,0,0
P457696,DeliKate Soothing Cleanser,Kate Somerville,0.700050694,-0.7953,0.9965,144,44,Skincare,Cleansers,433,123,310,584640,0,0,0,0
P457697,DeliKate Recovery Serum,Kate Somerville,0.766626282,-0.9073,0.9977,156,98,Skincare,Treatments,745,130,615,1361724,0,0,0,0
P457854,Vital Perfection Uplifting and Firming Cream Day Cream,Shiseido,0.822863158,-0.6466,0.9942,19,140,Skincare,Moisturizers,93,10,83,56221,0,0,1,0
P457864,Vital Skin-Strengthening Hyaluronic Acid Super Serum,Kiehl's Since 1851,0.721217755,-0.9477,0.9959,597,60,Skincare,Treatments,798,256,542,6150294,0,0,0,1
P458209,Daily Greens Oil-Free Gel Moisturizer with Moringa and Papaya,Farmacy,0.704060324,-0.9678,0.9979,1356,42,Skincare,Moisturizers,5278,1080,4198,97843536,0,0,0,0
P458216,Mini Yo Glow AHA & BHA Facial Enzyme Scrub,Wishful,0.644558861,-0.9659,0.9982,2212,21,Skincare,Mini Size,9591,2916,6675,84476280,0,0,0,0
P458219,Watermelon Glow PHA + BHA Pore-Tight Toner,Glow Recipe,0.720012346,-0.9598,0.9972,3321,34,Skincare,Cleansers,13029,3842,9187,839701566,0,0,0,0
P458546,Set The Stage Hydrating Primer Serum,LAWLESS,0.863735458,-0.7772,0.9964,251,32,Skincare,Treatments,638,184,454,3168875,0,0,0,0
P458573,Lip Balm Trio,Jack Black,0.667116667,-0.7177,0.9744,18,22,Skincare,Value & Gift Sets,85,9,76,154152,0,0,1,0
P458576,Water Drench Hyaluronic Hydrating Moisturizer SPF 45,Peter Thomas Roth,0.672794668,-0.9518,0.9964,844,55,Skincare,Moisturizers,2137,494,1643,22391320,0,0,0,0
P458724,Metal Facial Razor,SEPHORA COLLECTION,0.652685294,-0.8032,0.9894,238,18,Skincare,High Tech Tools,2922,439,2483,9100882,0,0,0,0
P458733,Mini Rose Quartz Facial Roller,SEPHORA COLLECTION,0.5807925,-0.7346,0.97,40,12,Skincare,Wellness,490,68,422,702240,0,0,0,0
P458755,Charlotte’s Magic Serum with Vitamin C,Charlotte Tilbury,0.75166478,-0.9487,0.9974,954,85,Skincare,Treatments,2972,748,2224,52619778,0,0,0,0
P458900,Pineapple Enzyme Pore Clearing Cleanser,Josie Maran,0.762823156,-0.8689,0.9952,678,29,Skincare,Cleansers,1451,472,979,10856814,0,0,0,0
P458917,Water-Lock Moisturizer with Skin-Smoothing Peptides,Tata Harper,0.825846221,-0.9044,0.9972,344,68,Skincare,Moisturizers,949,276,673,4766120,0,0,0,0
P458958,Hydrating Boob and Bum Sheet Mask Duo,INC.redible,0.749333333,-0.4335,0.9873,12,15,Skincare,Masks,2537,1630,907,122940,0,0,0,0
P458961,G.Tox Malachite and Fruit Acid Pore Purifying Cleanser,goop,0.770661111,-0.0772,0.9903,18,48,Skincare,Cleansers,95,12,83,43110,0,0,0,1
P458962,G.Tox Malachite and AHA Pore Refining Tonic,goop,0.5242,-0.4767,0.9867,15,75,Skincare,Cleansers,139,46,93,35595,0,0,0,0
P458963,G.Tox Detoxifying Superpowder,goop,0.32474,-0.4691,0.7794,5,12,Skincare,Wellness,52,13,39,4470,0,0,0,0
P458964,G.Tox Ultimate Dry Brush,goop,0.634588889,-0.8216,0.991,54,25,Skincare,High Tech Tools,647,97,550,916812,0,0,0,0
P459116,Mini Cream Skin Toner & Moisturizer,LANEIGE,0.666065385,-0.6862,0.9761,52,15,Skincare,Mini Size,262,71,191,885612,0,0,0,1
P459127,Platinum Lip Plump SPF 30,Dr. Lara Devgan Scientific Beauty,0.669120233,-0.8768,0.9884,514,50,Skincare,Lip Balms & Treatments,1359,253,1106,7351228,0,0,1,0
P459128,Vitamin C+B+E Ferulic Serum,Dr. Lara Devgan Scientific Beauty,0.61870456,-0.7669,0.9893,307,145,Skincare,Treatments,1507,376,1131,2837601,0,0,1,0
P459129,Peptide Eye Cream,Dr. Lara Devgan Scientific Beauty,0.615193657,-0.7842,0.9829,268,215,Skincare,Eye Care,1010,175,835,1463816,0,0,1,0
P459130,Hyaluronic Serum,Dr. Lara Devgan Scientific Beauty,0.665083178,-0.6996,0.9861,321,245,Skincare,Treatments,725,197,528,891417,0,0,1,0
P459131,3 Mega Wonders,OLEHENRIKSEN,0.688877778,-0.6705,0.9984,81,65,Skincare,Value & Gift Sets,696,131,565,1795446,0,0,0,0
P459133,Mini Truth Juice Daily Cleanser,OLEHENRIKSEN,0.704508712,-0.8618,0.9952,528,16,Skincare,Mini Size,2159,442,1717,3583008,0,0,0,0
P459140,Self-Tanning Water Refill,Isle of Paradise,0.556142857,-0.652,0.9732,42,24,Skincare,Self Tanners,390,116,274,528318,0,0,0,1
P459141,Deep Sweep 2% BHA Pore Cleaning Toner with Moringa + Papaya,Farmacy,0.675551644,-0.9729,0.9973,821,32,Skincare,Cleansers,5140,959,4181,76360389,0,0,0,0
P459299,Mini GOOPGLOW Microderm Instant Glow Exfoliator,goop,0.769363346,-0.8715,0.9966,2128,42,Skincare,Mini Size,2201,613,1588,30413376,0,0,0,0
P459300,Mini GOOPGLOW Morning Skin Superpowder,goop,0.773292613,-0.864,0.9981,1110,12,Skincare,Mini Size,512,192,320,2526360,0,0,0,0
P459301,Mini GOOPGLOW 15% Glycolic Acid Overnight Glow Peel,goop,0.719671321,-0.9519,0.9973,1196,45,Skincare,Mini Size,656,167,489,3860688,0,0,0,0
P459835,Mini Charlotte’s Magic Serum with Vitamin C,Charlotte Tilbury,0.348041463,-0.8974,0.9854,41,30,Skincare,Mini Size,458,79,379,1591579,0,0,0,0
P460010,Prep & Plane Facial Razors,TWEEZERMAN,0.320247368,-0.8506,0.996,38,10,Skincare,High Tech Tools,548,109,439,215118,0,0,0,0
P460511,Mini Liquid ExfoliKate Triple Acid Resurfacing Treatment,Kate Somerville,0.401877778,-0.7242,0.9603,18,24,Skincare,Mini Size,351,135,216,154728,0,0,0,0
P460512,Mini Liquid Silk Canvas: Featherweight Protective Primer,Tatcha,0.750499346,-0.9351,0.9983,1835,24,Skincare,Mini Size,10492,2293,8199,119304360,0,0,0,0
P460513,Cream Skin Mist,LANEIGE,0.780656849,-0.9324,0.9958,292,27,Skincare,Moisturizers,1631,247,1384,12605056,0,0,0,0
P460514,Cream Skin Milk Oil Cleanser,LANEIGE,0.759228618,-0.9322,0.9971,304,34,Skincare,Cleansers,1137,339,798,8334160,0,0,0,0
P460515,E-Rase Milki Micellar Water,Drunk Elephant,0.735460118,-0.9291,0.995,1018,14,Skincare,Cleansers,1997,413,1584,26601358,0,0,1,0
P460516,Papaya Sorbet Smoothing Enzyme Cleansing Balm & Makeup Remover,Glow Recipe,0.728132843,-0.9689,0.9972,1428,32,Skincare,Cleansers,4944,1458,3486,124772928,0,0,0,0
P460554,Clarifying Peel Pads,SEPHORA COLLECTION,0.682760684,-0.7351,0.996,117,17,Skincare,Treatments,567,109,458,1369485,0,0,0,0
P460578,GOOPGENES All-In-One Nourishing Face Cream,goop,0.75414458,-0.8516,0.9979,738,98,Skincare,Moisturizers,376,82,294,2204406,0,0,0,0
P460622,25 Years of Dr. Brandt Kit,Dr. Brandt Skincare,0.22165,-0.5267,0.97,2,165,Skincare,Value & Gift Sets,24,16,8,548,0,0,0,1
P460624,Discover Healthy Skin Kit,Dermalogica,0.844506971,-0.7755,0.998,416,39.5,Skincare,Value & Gift Sets,456,146,310,8831680,0,0,0,0
P460627,Saturn Sulfur + Niacinamide Spot Treatment Mask,Sunday Riley,0.261788889,-0.9118,0.997,99,20,Skincare,Masks,933,187,746,859122,0,0,0,0
P460701,Clean Face Mask,SEPHORA COLLECTION,0.647129275,-0.8236,0.9959,386,5.5,Skincare,Masks,985,320,665,31144024,0,0,0,0
P460704,The Hydrating Kit,SEPHORA COLLECTION,0.757144444,-0.2755,0.9819,18,20,Skincare,Value & Gift Sets,147,17,130,159246,0,0,0,0
P460723,Clean Cleansing & Gentle Exfoliating Wipes,SEPHORA COLLECTION,0.359618321,-0.9424,0.9971,524,6,Skincare,Cleansers,1724,114,1610,13762336,0,0,0,0
P460746,Aburatorigami Japanese Blotting Papers,Tatcha,0.66227037,-0.69,0.9809,54,14,Skincare,Cleansers,496,55,441,902556,0,0,0,0
P460747,Pink Cloud Rosewater + Squalane Makeup Removing Face Wash,Herbivore,0.713476545,-0.9308,0.9967,631,26,Skincare,Cleansers,3673,991,2682,25903181,0,0,0,0
P460756,Hyaluronic Dew Cream,Mario Badescu,0.54486,-0.3597,0.957,15,26,Skincare,Moisturizers,53,11,42,24705,0,0,0,0
P460757,Brightening Mask with Vitamin C,Mario Badescu,0.560325,0,0.9196,4,22,Skincare,Masks,27,10,17,8800,0,0,0,0
P460758,Cool Biotic Prebiotic Redness Relief Cream,Dr. Brandt Skincare,0.68127156,-0.8255,0.9929,109,56,Skincare,Moisturizers,453,121,332,893909,0,0,0,0
P460779,Skinlongevity Long Life Herb Anti-Aging Face Serum,bareMinerals,0.770274349,-0.9159,0.9983,3727,65,Skincare,Treatments,466,117,349,28377378,0,0,0,0
P460855,Clean Lip Balm & Scrub,SEPHORA COLLECTION,0.215197709,-0.9665,0.9972,611,7,Skincare,Lip Balms & Treatments,2814,454,2360,45286709,0,0,0,1
P460856,Clean Eye Mask,SEPHORA COLLECTION,0.652750938,-0.8812,0.9947,373,3.5,Skincare,Masks,1173,277,896,35120561,0,0,0,0
P461159,Estee Lauder Advanced Night Repair Synchronized Multi-Recovery Complex Serum,Estée Lauder,0.671639303,-0.9571,0.997,2412,115,Skincare,Treatments,4095,1353,2742,142001676,0,0,0,0
P461160,Mini Advanced Night Repair Synchronized Multi-Recovery Complex,Estée Lauder,0.671639303,-0.9571,0.997,2412,19,Skincare,Mini Size,4095,1353,2742,56315376,0,0,1,0
P461161,FAB Pharma BHA Acne Spot Treatment Gel 2% Salicylic Acid,First Aid Beauty,0.5698,-0.636,0.9814,77,26,Skincare,Treatments,392,77,315,1001154,0,0,0,0
P461162,FAB Pharma White Clay Acne Treatment Pads 2% Salicylic Acid,First Aid Beauty,0.512856923,-0.945,0.9883,65,30,Skincare,Treatments,495,38,457,885560,0,0,0,0
P461165,GOOPGENES All-In-One Nourishing Eye Cream,goop,0.693688198,-0.9244,0.9937,627,55,Skincare,Eye Care,234,49,185,1718607,0,0,0,0
P461177,Mini Turmeric BHA Pore & Brightening Treatment Mask,KORA Organics,0.647274949,-0.9296,0.9961,491,18,Skincare,Mini Size,3403,744,2659,6243556,0,0,1,0
P461195,Clean Hemp Mask,SEPHORA COLLECTION,0.558572222,-0.8868,0.973,36,5.5,Skincare,Masks,146,21,125,417204,0,0,0,0
P461199,Clean Peeling Mask,SEPHORA COLLECTION,0.629827273,-0.5423,0.9917,22,5.5,Skincare,Masks,165,13,152,159390,0,0,0,1
P461200,Clean Watermelon After Sun Mask,SEPHORA COLLECTION,0.711759259,-0.3477,0.979,27,5,Skincare,Masks,93,37,56,243000,0,0,0,0
P461213,Honey Balm Niacinamide Moisturizer,Wishful,0.722889193,-0.9286,0.9955,657,43,Skincare,Moisturizers,3010,614,2396,17008416,0,0,0,0
P461439,Hyaluronic Marine Makeup Removing Meltaway Cleanser,Dr. Dennis Gross Skincare,0.692081008,-0.9254,0.9957,595,32,Skincare,Cleansers,508,114,394,5151510,0,0,0,0
P461451,Abeille Royale Anti-Aging Fortifying Lotion Toner,GUERLAIN,0.795245683,-0.753,0.9973,834,85,Skincare,Cleansers,296,67,229,5404320,0,0,1,0
P461491,Bright Repair Eye Cream – 10% Vitamin C,Saint Jane Beauty,0.692561494,-0.7845,0.9916,174,65,Skincare,Eye Care,1036,141,895,1270896,0,0,0,0
P461520,Clean Foot Mask,SEPHORA COLLECTION,0.603387898,-0.9514,0.9955,157,5,Skincare,Masks,788,165,623,5398602,0,0,0,0
P461521,Clean Hand Mask,SEPHORA COLLECTION,0.59278209,-0.8016,0.9856,67,5,Skincare,Masks,312,81,231,1087209,0,0,0,0
P461522,Clean Charcoal Nose Strip,SEPHORA COLLECTION,0.300403226,-0.9653,0.9606,186,3,Skincare,Masks,669,181,488,4722168,0,0,0,0
P461535,All About Acne Breakout + Blackhead Set,Sunday Riley,0.611784,-0.6476,0.9928,25,95,Skincare,Value & Gift Sets,410,69,341,245925,0,0,0,0
P461537,The Rice Wash Skin-Softening Cleanser,Tatcha,0.763228781,-0.9369,0.9983,2453,40,Skincare,Cleansers,6429,1663,4766,467053653,0,0,0,0
P461555,Mini Superberry Hydrate + Glow Dream Mask,Youth To The People,0.657594688,-0.9864,0.9963,2353,18,Skincare,Mini Size,15227,3106,12121,187119972,0,0,0,0
P461667,Mini GO OFF Makeup Dissolving Mist,ONE/SIZE by Patrick Starrr,0.590294163,-0.8724,0.9973,257,18,Skincare,Mini Size,1915,462,1453,2406034,0,0,0,0
P461933,Advanced Night Repair Synchronized Multi-Recovery Complex Duo,Estée Lauder,0.671639303,-0.9571,0.997,2412,195,Skincare,Treatments,4095,1353,2742,27180828,1,0,1,0
P461935,BEAR Facial Toning Device,FOREO,0.808053275,-0.9666,0.9976,229,329,Skincare,High Tech Tools,1915,341,1574,2691437,0,0,1,0
P461936,BEAR mini Facial Toning Device,FOREO,0.741691228,-0.9315,0.9928,114,219,Skincare,High Tech Tools,1060,296,764,843714,0,0,0,0
P461937,Serum Serum Serum,FOREO,0.142215385,-0.7695,0.962,13,59,Skincare,Treatments,261,39,222,24050,0,0,1,0
P461947,Calendula Petal-Infused Calming Mask with Aloe Vera,Kiehl's Since 1851,0.6995,-0.9262,0.9837,45,47,Skincare,Masks,293,23,270,485955,0,0,0,0
P461948,Super Multi-Corrective Anti-Aging Face and Neck Cream,Kiehl's Since 1851,0.723245029,-0.8765,0.9913,171,76,Skincare,Moisturizers,615,172,443,1664343,0,0,0,0
P461949,The Concentrate Serum,La Mer,0.761738899,-0.9524,0.9931,563,425,Skincare,Treatments,1443,471,972,4230382,0,0,0,0
P461950,Mini The Concentrate Serum,La Mer,0.598666667,-0.3582,0.987,18,220,Skincare,Mini Size,257,50,207,115938,0,0,0,0
P462336,Aqua Bomb Cleansing Balm,belif,0.788829226,-0.9254,0.9968,1331,38,Skincare,Cleansers,662,208,454,19616278,0,0,0,0
P462339,Vitamin Enriched Eye Base,Bobbi Brown,0.795843983,-0.9052,0.9969,241,58,Skincare,Eye Care,1671,383,1288,5912212,0,0,0,0
P462344,Hydro Masque Exfoliant,Dermalogica,0.78306625,-0.9512,0.9963,320,64,Skincare,Cleansers,229,34,195,2143360,0,0,1,0
P462347,E-Rase Milki Micellar Water Mini,Drunk Elephant,0.735460118,-0.9291,0.995,1018,14,Skincare,Mini Size,1997,413,1584,20211372,0,0,1,0
P462375,Hyaluronic Dew Drops Hydrating Serum,Mario Badescu,-0.0632,-0.6483,0.685,6,30,Skincare,Treatments,47,9,38,12672,0,0,0,0
P462378,Anti-Aging Regimen Kit,Mario Badescu,0.67056,-0.0249,0.9595,10,30,Skincare,Value & Gift Sets,54,16,38,29620,0,0,0,0
P462379,Witch Hazel & Lavender Toner,Mario Badescu,0.462566667,-0.1416,0.8852,6,14,Skincare,Cleansers,19,3,16,12828,0,0,0,0
P462381,Glycolic Eye Cream,Mario Badescu,0.401677778,-0.8783,0.9065,9,20,Skincare,Eye Care,91,48,43,26388,0,0,0,1
P462383,Flower & Tonic Clay Mask,Mario Badescu,0.590775,-0.2617,0.9769,4,18,Skincare,Masks,28,12,16,9332,0,0,0,1
P462384,Spritz. Mist. Glow. Facial Spray Trio,Mario Badescu,0.64364,0.0772,0.9042,5,21,Skincare,Value & Gift Sets,51,21,30,26935,0,0,0,0
P462386,Drying Cream,Mario Badescu,0.7598,0.3612,0.9804,4,17,Skincare,Treatments,55,9,46,6540,0,0,1,0
P462390,PRO Strength 10% PHA Exfoliating Clarifying Liquid,Peter Thomas Roth,0.702582877,-0.8932,0.9933,438,58,Skincare,Treatments,428,68,360,2724360,0,0,0,0
P462666,Total Eye Lift Firming & Smoothing Anti-Aging Eye Cream,Clarins,0.76331608,-0.9297,0.9932,398,90,Skincare,Eye Care,717,146,571,5975970,0,0,0,0
P462699,Plum Plump Hyaluronic Acid Serum,Glow Recipe,0.745385372,-0.9101,0.9982,1921,45,Skincare,Treatments,6693,2144,4549,306090219,0,0,0,0
P462747,Mini Clarifying Blemish & Oil Control Cleanser,Tata Harper,0.582937453,-0.9781,0.9948,267,46,Skincare,Mini Size,1929,426,1503,1080549,0,0,1,0
P462748,Mini Purifying Pore Detox Cleanser,Tata Harper,0.73207,-0.7905,0.9955,170,46,Skincare,Mini Size,1091,208,883,527680,0,0,1,0
P462829,Squalane + Elderberry Nourishing Jelly Cleanser,Biossance,0.622366245,-0.8832,0.9975,237,28,Skincare,Cleansers,1525,396,1129,5031036,0,0,0,1
P462891,GinZing Into the Glow Brightening Serum,Origins,0.770007722,-0.6471,0.9968,259,46,Skincare,Treatments,1138,262,876,6529649,0,0,1,0
P463036,Honey Halo Ultra-Hydrating Ceramide Moisturizer,Farmacy,0.733772409,-0.9388,0.9992,1341,48,Skincare,Moisturizers,5828,1268,4560,176893992,0,0,0,0
P463105,Benefiance Wrinkle Smoothing Retinol Serum,Shiseido,0.78115048,-0.9161,0.9949,937,75,Skincare,Treatments,297,101,196,5361514,0,0,0,0
P463106,Vital Perfection Uplifting and Firming Eye Cream,Shiseido,0.816,0.5023,0.9674,5,85,Skincare,Eye Care,38,17,21,13245,0,0,1,0
P463109,Overnight Vitalizing Sleeping Mask,Sulwhasoo,0.686575,0.0202,0.9253,4,54,Skincare,Masks,42,11,31,1036,0,0,0,0
P463110,Clarifying Peel Off Mask,Sulwhasoo,0.57244,0,0.925,10,45,Skincare,Masks,69,14,55,29630,0,0,0,0
P463144,Dream Eye Cream with Vitamin C and Ceramides,Youth To The People,0.590702377,-0.9371,0.9968,547,48,Skincare,Eye Care,3314,693,2621,29909413,0,0,0,0
P463353,CC Screen 100% Mineral CC Cream SPF 50 PA++++,Supergoop!,0.630445833,-0.9756,0.9981,528,44,Skincare,Moisturizers,3799,337,3462,19902960,0,0,0,0
P463371,Mini Adaptogen Deep Moisture Cream with Ashwagandha + Reishi,Youth To The People,0.671852654,-0.9377,0.9974,2072,18,Skincare,Mini Size,10202,1772,8430,59998904,0,0,1,0
P463613,Moisture Surge Intense 72H Lipid-Replenishing Hydrator Moisturizer,CLINIQUE,0.513742708,-0.9579,0.9938,96,44,Skincare,Moisturizers,761,119,642,621408,0,0,0,0
P463665,Get Even Rose Face Oil,Wishful,0.717103958,-0.8494,0.9966,379,63,Skincare,Moisturizers,1283,330,953,4714381,0,0,0,0
P463791,GloPRO SCALP MicroTip Attachment Head,BeautyBio,0.491781818,-0.8537,0.9692,11,59,Skincare,High Tech Tools,263,62,201,54494,0,0,0,0
P463792,Rejuvenating Scalp + Fuller Hair Therapy Set,BeautyBio,0.584223077,-0.6846,0.9692,13,249,Skincare,Value & Gift Sets,637,149,488,75530,0,0,0,0
P463951,Mini Benefiance Wrinkle Smoothing Cream Enriched,Shiseido,0.052128571,-0.8686,0.7269,7,30,Skincare,Mini Size,36,12,24,28273,0,0,0,0
P463964,Pink Drink Firming Resurfacing Peptide Face Mist,Sunday Riley,0.571909474,-0.7356,0.9894,95,48,Skincare,Moisturizers,1616,394,1222,1881760,0,0,0,0
P464233,Mini Face Cream,Dr. Barbara Sturm,0.729867901,-0.8932,0.9981,810,75,Skincare,Moisturizers,1291,283,1008,1783620,0,0,0,1
P464234,Advanced Retinol Night Repair Treatment,Dr. Zenovia Skincare,0.756683521,-0.7706,0.9956,267,72,Skincare,Treatments,254,50,204,763620,0,0,1,0
P464235,Inflam-Aging Night Repair Treatment,Dr. Zenovia Skincare,0.719218462,-0.7495,0.9911,260,72,Skincare,Treatments,75,27,48,384280,0,0,1,0
P464237,Retinol Recovery Eye Cream,Dr. Zenovia Skincare,0.593257426,-0.8856,0.9967,101,64,Skincare,Eye Care,81,27,54,137966,0,0,1,0
P464238,Peptide + Ceramide Repairing Moisturizer,Dr. Zenovia Skincare,0.77142948,-0.8749,0.9954,519,79,Skincare,Moisturizers,417,78,339,2856576,0,0,1,0
P464239,Aloe Vera Blemish Soothing Moisturizer,Dr. Zenovia Skincare,0.739343767,-0.6908,0.9976,377,38,Skincare,Moisturizers,210,40,170,2249936,0,0,1,0
P464240,10% Glycolic Acne Control Peel Pads,Dr. Zenovia Skincare,0.686037143,-0.7858,0.9951,105,42,Skincare,Treatments,133,35,98,359625,0,0,1,0
P464241,5% Benzoyl Peroxide Acne Spot Treatment,Dr. Zenovia Skincare,0.548454704,-0.9698,0.9971,287,25,Skincare,Treatments,301,32,269,2054920,0,0,1,0
P464242,Hyaluronic Acid + Peptide Serum,Dr. Zenovia Skincare,0.797586885,-0.4439,0.9936,122,72,Skincare,Treatments,151,44,107,301584,0,0,1,0
P464243,10% Benzoyl Peroxide Acne Cleanser,Dr. Zenovia Skincare,0.675681336,-0.901,0.9956,434,30,Skincare,Cleansers,384,76,308,3630844,0,0,1,0
P464244,Vitamin C Brightening Toner,Dr. Zenovia Skincare,0.785235514,-0.5041,0.9975,107,38,Skincare,Cleansers,122,15,107,410880,0,0,1,0
P464245,Bakuchiol Hydrating Cleanser,Dr. Zenovia Skincare,0.770975748,-0.8307,0.9977,301,42,Skincare,Cleansers,112,15,97,536984,0,0,1,0
P464250,GOOPGENES Nourishing Repair Body Butter,goop,0.514456522,-0.8074,0.9678,23,65,Skincare,Moisturizers,122,14,108,32269,0,0,0,0
P464288,Sephora City Reusable Water Bottle,SEPHORA COLLECTION,0.340970588,-0.5994,0.9875,17,8,Skincare,Wellness,395,74,321,114818,0,0,0,0
P464799,Potent-C Power Brightening Hydra-Gels,Peter Thomas Roth,0.189421429,-0.7441,0.9868,28,65,Skincare,Eye Care,283,95,188,274820,0,0,0,0
P465365,Puffy Under-Eye Patches,Peace Out,0.679250838,-0.7464,0.9922,179,25,Skincare,Eye Care,900,216,684,5039208,0,0,0,0
P465368,Mini Ready Steady Glow Daily AHA Tonic,REN Clean Skincare,0.584765126,-0.9603,0.9968,1233,22,Skincare,Cleansers,6309,1232,5077,25710516,0,0,0,0
P465741,Wild Huckleberry 8-Acid Polishing Peel Mask,alpyn beauty,0.840099427,-0.7469,0.9962,349,56,Skincare,Masks,1562,517,1045,9792940,0,0,0,0
P465752,Mini Protini Polypeptide Moisturizer,Drunk Elephant,0.495198765,-0.9786,0.9762,162,22,Skincare,Mini Size,994,247,747,8469684,0,0,0,0
P465803,Blue Aventurine De-Puffing Facial Roller,SEPHORA COLLECTION,0.821053333,-0.5638,0.9947,150,20,Skincare,Wellness,382,78,304,1785600,0,0,0,0
P465808,4 Piece Facial Razor Set,SEPHORA COLLECTION,0.415345333,-0.8972,0.9714,75,12,Skincare,High Tech Tools,627,126,501,2593500,0,0,0,0
P466114,Resveratrol Lift Instant Firming Retinol Alternative Serum,Caudalie,0.78818743,-0.8954,0.9975,358,84,Skincare,Treatments,2358,617,1741,17448562,0,0,0,0
P466117,Sweet Biome Fermented Sake Hydrating Spray,Drunk Elephant,0.697389217,-0.9698,0.9975,677,42,Skincare,Moisturizers,1592,425,1167,10523965,0,0,0,0
P466122,Kombucha 2-in-1 No-Rinse Cleanser & Prebiotic Treatment,fresh,0.797935056,-0.8626,0.9978,716,44,Skincare,Cleansers,564,136,428,6413212,0,0,0,0
P466123,Watermelon Glow Niacinamide Dew Drops,Glow Recipe,0.764446136,-0.9027,0.9986,2200,35,Skincare,Treatments,11777,2977,8800,856268600,0,0,0,0
P466134,Radian-C Cream with Vitamin C,LANEIGE,0.79981788,-0.9477,0.9968,632,35,Skincare,Moisturizers,1895,666,1229,29023336,0,0,0,0
P466142,Lemonade Smoothing Scrub,OLEHENRIKSEN,0.819307361,-0.9385,0.9976,1277,35,Skincare,Cleansers,1856,616,1240,54538116,0,0,0,0
P466153,Cloud Dew Gel Cream Moisturizer,Summer Fridays,0.768406714,-0.9301,0.9974,700,45,Skincare,Moisturizers,2640,570,2070,36286600,0,0,0,0
P466154,Daily Dose Vitamin C + SPF 40 Sunscreen Serum PA+++,Supergoop!,0.676986237,-0.9479,0.998,574,46,Skincare,Sunscreen,2225,418,1807,23995496,0,0,0,0
P466155,The Dewy Serum Resurfacing and Plumping Treatment,Tatcha,0.823142991,-0.9186,0.9972,1391,89,Skincare,Treatments,3987,949,3038,107144557,0,0,0,0
P466163,Thirst Trap Juice Hyaluronic Acid & Peptide Hydrating Facial Serum,Wishful,0.742540323,-0.8242,0.9959,434,47,Skincare,Treatments,876,198,678,8542856,0,0,0,0
P466164,15% Vitamin C + Clean Caffeine Energy Serum,Youth To The People,0.742941793,-0.8902,0.9982,993,69,Skincare,Treatments,4681,935,3746,94858311,0,0,0,0
